{
  "schema_version": 1,
  "logic": "QF_S",
  "declarations": [
    {
      "kind": "constant",
      "symbol": "y",
      "parameter_sorts": [],
      "return_sort": "String"
    },
    {
      "kind": "constant",
      "symbol": "y1",
      "parameter_sorts": [],
      "return_sort": "String"
    },
    {
      "kind": "constant",
      "symbol": "y2",
      "parameter_sorts": [],
      "return_sort": "String"
    },
    {
      "kind": "constant",
      "symbol": "y3",
      "parameter_sorts": [],
      "return_sort": "String"
    },
    {
      "kind": "constant",
      "symbol": "x",
      "parameter_sorts": [],
      "return_sort": "String"
    },
    {
      "kind": "constant",
      "symbol": "z",
      "parameter_sorts": [],
      "return_sort": "String"
    }
  ],
  "cnf": "(⟦(= y1 (str.replace_all y \"u\" \"A\"))⟧) ∧\n(⟦(= y2 (str.replace_all y1 \"a\" \"T\"))⟧) ∧\n(⟦(= y3 (str.replace_all y2 \"g\" \"C\"))⟧) ∧\n(⟦(= x (str.replace_all y3 \"c\" \"G\"))⟧) ∧\n(⟦(= x \"CGTTGAACATTGACAGTGCCGAGGTCCAGCTCGTAGTCGGTTTTGCGTGAGTGGTCTTCCCGGAGTTTAACCTTAATACAGTTCCACACTCGCGACGACGTTAAAGAGTGAGACTAATGAGAGCGGCCTCTAGAGGTTGTGAACTGGACCAGCAAGTGGGTTCGCGACTCTATGGCCCTCTAGAACTGCGTCATTGCTAG\")⟧) ∧\n(⟦(= z \"auuucucacucugau\")⟧) ∧\n(⟦(str.contains y z)⟧)"
}
