{
  "schema_version": 1,
  "logic": "QF_ALIA",
  "declarations": [
    {
      "kind": "constant",
      "symbol": "a_3",
      "parameter_sorts": [],
      "return_sort": "(Array Int Int)"
    },
    {
      "kind": "constant",
      "symbol": "a_7",
      "parameter_sorts": [],
      "return_sort": "(Array Int Int)"
    },
    {
      "kind": "constant",
      "symbol": "e_0",
      "parameter_sorts": [],
      "return_sort": "Int"
    },
    {
      "kind": "constant",
      "symbol": "e_1",
      "parameter_sorts": [],
      "return_sort": "Int"
    },
    {
      "kind": "constant",
      "symbol": "e_2",
      "parameter_sorts": [],
      "return_sort": "Int"
    },
    {
      "kind": "constant",
      "symbol": "e_4",
      "parameter_sorts": [],
      "return_sort": "Int"
    },
    {
      "kind": "constant",
      "symbol": "e_5",
      "parameter_sorts": [],
      "return_sort": "Int"
    },
    {
      "kind": "constant",
      "symbol": "e_6",
      "parameter_sorts": [],
      "return_sort": "Int"
    },
    {
      "kind": "constant",
      "symbol": "a",
      "parameter_sorts": [],
      "return_sort": "(Array Int Int)"
    },
    {
      "kind": "constant",
      "symbol": "i",
      "parameter_sorts": [],
      "return_sort": "Int"
    }
  ],
  "cnf": "(⟦(= a_3 (store a e_0 e_2))⟧) ∧\n(⟦(= a_7 (store a e_4 e_6))⟧) ∧\n(⟦(= e_0 (+ i 1))⟧) ∧\n(⟦(= e_1 (select a i))⟧) ∧\n(⟦(= e_2 (+ e_1 1))⟧) ∧\n(⟦(= e_4 (+ i 0))⟧) ∧\n(⟦(= e_5 (select a e_0))⟧) ∧\n(⟦(= e_6 (- e_5 1))⟧) ∧\n(⟦(= a_3 a_7)⟧) ∧\n(¬⟦(= e_2 e_5)⟧)"
}
