{
  "schema_version": 1,
  "logic": "LIA",
  "declarations": [
    {
      "kind": "constant",
      "symbol": "c_main_~i~6",
      "parameter_sorts": [],
      "return_sort": "Int"
    },
    {
      "kind": "constant",
      "symbol": "c_main_~j~6",
      "parameter_sorts": [],
      "return_sort": "Int"
    },
    {
      "kind": "constant",
      "symbol": "c_main_~k~6",
      "parameter_sorts": [],
      "return_sort": "Int"
    }
  ],
  "cnf": "(¬τ1 ∨ ⟦(<= c_main_~k~6 c_main_~i~6)⟧) ∧\n(¬τ1 ∨ ⟦(<= (+ (* 2 c_main_~i~6) 1) c_main_~j~6)⟧) ∧\n(¬τ1 ∨ ⟦(<= 3 c_main_~i~6)⟧) ∧\n(τ1 ∨ ¬⟦(<= c_main_~k~6 c_main_~i~6)⟧ ∨ ¬⟦(<= (+ (* 2 c_main_~i~6) 1) c_main_~j~6)⟧ ∨ ¬⟦(<= 3 c_main_~i~6)⟧) ∧\n(τ1) ∧\n(¬τ2 ∨ ⟦(<= 3 c_main_~i~6)⟧) ∧\n(¬τ2 ∨ ⟦(<= 2 c_main_~i~6)⟧) ∧\n(¬τ2 ∨ ⟦(<= 1 c_main_~i~6)⟧) ∧\n(¬τ2 ∨ ⟦(<= 0 c_main_~i~6)⟧) ∧\n(¬τ2 ∨ ⟦(<= (* 2 c_main_~i~6) c_main_~j~6)⟧) ∧\n(¬τ2 ∨ ⟦(exists ((v_nnf_40 Int)) (and (<= c_main_~k~6 (+ v_nnf_40 2)) (<= (+ (* 2 v_nnf_40) 1) c_main_~j~6) (<= 3 v_nnf_40)))⟧) ∧\n(τ2 ∨ ¬⟦(<= 3 c_main_~i~6)⟧ ∨ ¬⟦(<= 2 c_main_~i~6)⟧ ∨ ¬⟦(<= 1 c_main_~i~6)⟧ ∨ ¬⟦(<= 0 c_main_~i~6)⟧ ∨ ¬⟦(<= (* 2 c_main_~i~6) c_main_~j~6)⟧ ∨ ¬⟦(exists ((v_nnf_40 Int)) (and (<= c_main_~k~6 (+ v_nnf_40 2)) (<= (+ (* 2 v_nnf_40) 1) c_main_~j~6) (<= 3 v_nnf_40)))⟧) ∧\n(¬τ2)"
}
