{
  "schema_version": 1,
  "logic": "LIA",
  "declarations": [
    {
      "kind": "constant",
      "symbol": "c_main_~x~0",
      "parameter_sorts": [],
      "return_sort": "Int"
    },
    {
      "kind": "constant",
      "symbol": "c_main_~y~0",
      "parameter_sorts": [],
      "return_sort": "Int"
    },
    {
      "kind": "constant",
      "symbol": "c_main_~z~0",
      "parameter_sorts": [],
      "return_sort": "Int"
    }
  ],
  "cnf": "(¬τ1 ∨ ⟦(exists ((|v_main_#t~nondet1_6| Int) (|v_main_#t~nondet1_5| Int)) (= c_main_~y~0 (+ (* 2097152 |v_main_#t~nondet1_6|) (* 2097152 |v_main_#t~nondet1_5|))))⟧) ∧\n(¬τ1 ∨ ⟦(exists ((|v_main_#t~nondet0_5| Int) (|v_main_#t~nondet0_6| Int)) (= c_main_~x~0 (+ (* 1048576 |v_main_#t~nondet0_5|) (* 1048576 |v_main_#t~nondet0_6|))))⟧) ∧\n(¬τ1 ∨ ⟦(exists ((|v_main_#t~nondet2_5| Int) (|v_main_#t~nondet2_6| Int)) (= (+ (* 4194304 |v_main_#t~nondet2_5|) (* 4194304 |v_main_#t~nondet2_6|)) c_main_~z~0))⟧) ∧\n(τ1 ∨ ¬⟦(exists ((|v_main_#t~nondet1_6| Int) (|v_main_#t~nondet1_5| Int)) (= c_main_~y~0 (+ (* 2097152 |v_main_#t~nondet1_6|) (* 2097152 |v_main_#t~nondet1_5|))))⟧ ∨ ¬⟦(exists ((|v_main_#t~nondet0_5| Int) (|v_main_#t~nondet0_6| Int)) (= c_main_~x~0 (+ (* 1048576 |v_main_#t~nondet0_5|) (* 1048576 |v_main_#t~nondet0_6|))))⟧ ∨ ¬⟦(exists ((|v_main_#t~nondet2_5| Int) (|v_main_#t~nondet2_6| Int)) (= (+ (* 4194304 |v_main_#t~nondet2_5|) (* 4194304 |v_main_#t~nondet2_6|)) c_main_~z~0))⟧) ∧\n(τ1) ∧\n(¬τ2 ∨ ⟦(exists ((|v_main_#t~nondet1_6| Int) (|v_main_#t~nondet1_7| Int) (|v_main_#t~nondet1_5| Int)) (= (+ (* 2097152 |v_main_#t~nondet1_6|) (* 2097152 |v_main_#t~nondet1_7|) (* 2097152 |v_main_#t~nondet1_5|)) c_main_~y~0))⟧) ∧\n(¬τ2 ∨ ⟦(exists ((|v_main_#t~nondet0_7| Int) (|v_main_#t~nondet0_5| Int) (|v_main_#t~nondet0_6| Int)) (= (+ (* 1048576 |v_main_#t~nondet0_7|) (* 1048576 |v_main_#t~nondet0_5|) (* 1048576 |v_main_#t~nondet0_6|)) c_main_~x~0))⟧) ∧\n(¬τ2 ∨ ⟦(exists ((|v_main_#t~nondet2_7| Int) (|v_main_#t~nondet2_5| Int) (|v_main_#t~nondet2_6| Int)) (= c_main_~z~0 (+ (* 4194304 |v_main_#t~nondet2_7|) (* 4194304 |v_main_#t~nondet2_5|) (* 4194304 |v_main_#t~nondet2_6|))))⟧) ∧\n(τ2 ∨ ¬⟦(exists ((|v_main_#t~nondet1_6| Int) (|v_main_#t~nondet1_7| Int) (|v_main_#t~nondet1_5| Int)) (= (+ (* 2097152 |v_main_#t~nondet1_6|) (* 2097152 |v_main_#t~nondet1_7|) (* 2097152 |v_main_#t~nondet1_5|)) c_main_~y~0))⟧ ∨ ¬⟦(exists ((|v_main_#t~nondet0_7| Int) (|v_main_#t~nondet0_5| Int) (|v_main_#t~nondet0_6| Int)) (= (+ (* 1048576 |v_main_#t~nondet0_7|) (* 1048576 |v_main_#t~nondet0_5|) (* 1048576 |v_main_#t~nondet0_6|)) c_main_~x~0))⟧ ∨ ¬⟦(exists ((|v_main_#t~nondet2_7| Int) (|v_main_#t~nondet2_5| Int) (|v_main_#t~nondet2_6| Int)) (= c_main_~z~0 (+ (* 4194304 |v_main_#t~nondet2_7|) (* 4194304 |v_main_#t~nondet2_5|) (* 4194304 |v_main_#t~nondet2_6|))))⟧) ∧\n(¬τ2)"
}
