{
  "schema_version": 1,
  "logic": "QF_S",
  "declarations": [
    {
      "kind": "constant",
      "symbol": "X",
      "parameter_sorts": [],
      "return_sort": "String"
    }
  ],
  "cnf": "(⟦(str.in_re X (re.++ (str.to_re \"\\u{5c}\\u{a}{\\u{5c}f\") (re.* (re.range \"0\" \"9\")) (re.+ (re.comp (str.to_re \";\"))) (str.to_re \";\")))⟧) ∧\n(⟦(str.in_re X (re.++ (str.to_re \"forum=\") (re.+ (re.union (str.to_re \" \") (str.to_re \"\\u{9}\") (str.to_re \"\\u{a}\") (str.to_re \"\\u{c}\") (str.to_re \"\\u{d}\"))) (str.to_re \"/toolbar/ico/\\u{a}\")))⟧) ∧\n(⟦(str.in_re X (re.++ (str.to_re \"\\u{a}\") (re.union (str.to_re \"www\") (str.to_re \"http\")) (re.+ (re.comp (re.union (re.range \"0\" \"9\") (re.range \"A\" \"Z\") (re.range \"a\" \"z\") (str.to_re \"_\")))) (re.+ (re.comp (re.union (str.to_re \" \") (str.to_re \"\\u{9}\") (str.to_re \"\\u{a}\") (str.to_re \"\\u{c}\") (str.to_re \"\\u{d}\")))) (re.+ (re.union (str.to_re \")\") (str.to_re \".\") (str.to_re \",\") (str.to_re \":\") (str.to_re \";\") (str.to_re \"?\") (str.to_re \"]\") (str.to_re \"}\") (str.to_re \" \") (str.to_re \"\\u{d}\") (str.to_re \"\\u{a}\") (str.to_re \"$\")))))⟧) ∧\n(¬⟦(str.in_re X (re.union (re.++ (str.to_re \"{\") (re.+ re.allchar)) (re.++ (str.to_re \"\\u{5c}\") (re.+ re.allchar)) (re.++ (re.* (str.to_re \"}\")) (str.to_re \"\\u{a}\"))))⟧) ∧\n(⟦(str.in_re X (re.++ (str.to_re \"/filename=\") (re.* (re.comp (str.to_re \"\\u{a}\"))) (str.to_re \".mpeg/i\\u{a}\")))⟧)"
}
