{
  "schema_version": 1,
  "logic": "LIA",
  "declarations": [
    {
      "kind": "constant",
      "symbol": "P",
      "parameter_sorts": [],
      "return_sort": "Int"
    }
  ],
  "cnf": "(¬τ1 ∨ ⟦(<= 0 P)⟧) ∧\n(¬τ1 ∨ ⟦(forall ((x0 Int) (x1 Int)) (=> (and (<= 0 x0) (<= 0 x1)) (not (= (+ (* x0 197) (* x1 199)) P))))⟧) ∧\n(¬τ1 ∨ ⟦(forall ((R Int)) (=> (forall ((x0 Int) (x1 Int)) (=> (and (<= 0 x0) (<= 0 x1)) (not (= (+ (* x0 197) (* x1 199)) R)))) (<= R P)))⟧) ∧\n(τ1 ∨ ¬⟦(<= 0 P)⟧ ∨ ¬⟦(forall ((x0 Int) (x1 Int)) (=> (and (<= 0 x0) (<= 0 x1)) (not (= (+ (* x0 197) (* x1 199)) P))))⟧ ∨ ¬⟦(forall ((R Int)) (=> (forall ((x0 Int) (x1 Int)) (=> (and (<= 0 x0) (<= 0 x1)) (not (= (+ (* x0 197) (* x1 199)) R)))) (<= R P)))⟧) ∧\n(τ1)"
}
