{
  "schema_version": 1,
  "logic": "QF_AUFLIA",
  "declarations": [
    {
      "kind": "constant",
      "symbol": "a_46",
      "parameter_sorts": [],
      "return_sort": "(Array Int Int)"
    },
    {
      "kind": "constant",
      "symbol": "a_47",
      "parameter_sorts": [],
      "return_sort": "(Array Int Int)"
    },
    {
      "kind": "constant",
      "symbol": "a_48",
      "parameter_sorts": [],
      "return_sort": "(Array Int Int)"
    },
    {
      "kind": "constant",
      "symbol": "a_49",
      "parameter_sorts": [],
      "return_sort": "(Array Int Int)"
    },
    {
      "kind": "constant",
      "symbol": "a_50",
      "parameter_sorts": [],
      "return_sort": "(Array Int Int)"
    },
    {
      "kind": "constant",
      "symbol": "a_51",
      "parameter_sorts": [],
      "return_sort": "(Array Int Int)"
    },
    {
      "kind": "constant",
      "symbol": "a_52",
      "parameter_sorts": [],
      "return_sort": "(Array Int Int)"
    },
    {
      "kind": "constant",
      "symbol": "a_53",
      "parameter_sorts": [],
      "return_sort": "(Array Int Int)"
    },
    {
      "kind": "constant",
      "symbol": "a_54",
      "parameter_sorts": [],
      "return_sort": "(Array Int Int)"
    },
    {
      "kind": "constant",
      "symbol": "a_55",
      "parameter_sorts": [],
      "return_sort": "(Array Int Int)"
    },
    {
      "kind": "constant",
      "symbol": "a_56",
      "parameter_sorts": [],
      "return_sort": "(Array Int Int)"
    },
    {
      "kind": "constant",
      "symbol": "a_57",
      "parameter_sorts": [],
      "return_sort": "(Array Int Int)"
    },
    {
      "kind": "constant",
      "symbol": "a_58",
      "parameter_sorts": [],
      "return_sort": "(Array Int Int)"
    },
    {
      "kind": "constant",
      "symbol": "a_59",
      "parameter_sorts": [],
      "return_sort": "(Array Int Int)"
    },
    {
      "kind": "constant",
      "symbol": "a_60",
      "parameter_sorts": [],
      "return_sort": "(Array Int Int)"
    },
    {
      "kind": "constant",
      "symbol": "a_61",
      "parameter_sorts": [],
      "return_sort": "(Array Int Int)"
    },
    {
      "kind": "constant",
      "symbol": "a_62",
      "parameter_sorts": [],
      "return_sort": "(Array Int Int)"
    },
    {
      "kind": "constant",
      "symbol": "a_63",
      "parameter_sorts": [],
      "return_sort": "(Array Int Int)"
    },
    {
      "kind": "constant",
      "symbol": "a_64",
      "parameter_sorts": [],
      "return_sort": "(Array Int Int)"
    },
    {
      "kind": "constant",
      "symbol": "a_65",
      "parameter_sorts": [],
      "return_sort": "(Array Int Int)"
    },
    {
      "kind": "constant",
      "symbol": "e_67",
      "parameter_sorts": [],
      "return_sort": "Int"
    },
    {
      "kind": "constant",
      "symbol": "e_68",
      "parameter_sorts": [],
      "return_sort": "Int"
    },
    {
      "kind": "constant",
      "symbol": "i_66",
      "parameter_sorts": [],
      "return_sort": "Int"
    },
    {
      "kind": "constant",
      "symbol": "a1",
      "parameter_sorts": [],
      "return_sort": "(Array Int Int)"
    },
    {
      "kind": "constant",
      "symbol": "e1",
      "parameter_sorts": [],
      "return_sort": "Int"
    },
    {
      "kind": "constant",
      "symbol": "e10",
      "parameter_sorts": [],
      "return_sort": "Int"
    },
    {
      "kind": "constant",
      "symbol": "e2",
      "parameter_sorts": [],
      "return_sort": "Int"
    },
    {
      "kind": "constant",
      "symbol": "e3",
      "parameter_sorts": [],
      "return_sort": "Int"
    },
    {
      "kind": "constant",
      "symbol": "e4",
      "parameter_sorts": [],
      "return_sort": "Int"
    },
    {
      "kind": "constant",
      "symbol": "e5",
      "parameter_sorts": [],
      "return_sort": "Int"
    },
    {
      "kind": "constant",
      "symbol": "e6",
      "parameter_sorts": [],
      "return_sort": "Int"
    },
    {
      "kind": "constant",
      "symbol": "e7",
      "parameter_sorts": [],
      "return_sort": "Int"
    },
    {
      "kind": "constant",
      "symbol": "e8",
      "parameter_sorts": [],
      "return_sort": "Int"
    },
    {
      "kind": "constant",
      "symbol": "e9",
      "parameter_sorts": [],
      "return_sort": "Int"
    },
    {
      "kind": "function",
      "symbol": "sk",
      "parameter_sorts": [
        "(Array Int Int)",
        "(Array Int Int)"
      ],
      "return_sort": "Int"
    }
  ],
  "cnf": "(⟦(= a_46 (store a1 1 e1))⟧) ∧\n(⟦(= a_47 (store a_46 2 e2))⟧) ∧\n(⟦(= a_48 (store a_47 3 e3))⟧) ∧\n(⟦(= a_49 (store a_48 4 e4))⟧) ∧\n(⟦(= a_50 (store a_49 5 e5))⟧) ∧\n(⟦(= a_51 (store a_50 6 e6))⟧) ∧\n(⟦(= a_52 (store a_51 7 e7))⟧) ∧\n(⟦(= a_53 (store a_52 8 e8))⟧) ∧\n(⟦(= a_54 (store a_53 9 e9))⟧) ∧\n(⟦(= a_55 (store a_54 1 e1))⟧) ∧\n(⟦(= a_56 (store a1 2 e2))⟧) ∧\n(⟦(= a_57 (store a_56 4 e4))⟧) ∧\n(⟦(= a_58 (store a_57 1 e1))⟧) ∧\n(⟦(= a_59 (store a_58 9 e9))⟧) ∧\n(⟦(= a_60 (store a_59 5 e5))⟧) ∧\n(⟦(= a_61 (store a_60 3 e3))⟧) ∧\n(⟦(= a_62 (store a_61 8 e8))⟧) ∧\n(⟦(= a_63 (store a_62 7 e7))⟧) ∧\n(⟦(= a_64 (store a_63 10 e10))⟧) ∧\n(⟦(= a_65 (store a_64 6 e6))⟧) ∧\n(⟦(= e_67 (select a_55 i_66))⟧) ∧\n(⟦(= e_68 (select a_65 i_66))⟧) ∧\n(⟦(= i_66 (sk a_55 a_65))⟧) ∧\n(¬⟦(= e_67 e_68)⟧)"
}
