{
  "schema_version": 1,
  "logic": "QF_S",
  "declarations": [
    {
      "kind": "constant",
      "symbol": "X",
      "parameter_sorts": [],
      "return_sort": "String"
    }
  ],
  "cnf": "(¬⟦(str.in_re X (re.++ (str.to_re \"User-Agent:\") (re.* re.allchar) (str.to_re \"Host:\") (re.range \"0\" \"9\") (str.to_re \"Name=Your+Host+is:\\u{a}\")))⟧)"
}
