{
  "schema_version": 1,
  "logic": "NIA",
  "declarations": [
    {
      "kind": "constant",
      "symbol": "~a3~0",
      "parameter_sorts": [],
      "return_sort": "Int"
    }
  ],
  "cnf": "(¬⟦(exists ((v_~a3~0_2178 Int) (v_prenex_3 Int) (v_~a3~0_2176 Int)) (and (= 0 (mod v_prenex_3 5)) (< 115 v_~a3~0_2176) (<= (+ ~a3~0 125943) (div (+ v_~a3~0_2178 (- 600335)) 5)) (not (= 0 (mod v_~a3~0_2178 5))) (<= 0 v_~a3~0_2176) (<= v_prenex_3 (+ (mod v_~a3~0_2176 55) 336)) (<= v_~a3~0_2178 (+ (div (+ v_prenex_3 (- 210150)) 5) 219839)) (< v_~a3~0_2178 600335)))⟧) ∧\n(⟦(exists ((v_prenex_3 Int) (v_~a3~0_2176 Int) (v_prenex_13 Int)) (and (<= v_prenex_13 (+ (div (+ v_prenex_3 (- 210150)) 5) 219839)) (= 0 (mod v_prenex_3 5)) (< 115 v_~a3~0_2176) (<= (+ ~a3~0 125944) (div (+ v_prenex_13 (- 600335)) 5)) (= 0 (mod v_prenex_13 5)) (<= 0 v_~a3~0_2176) (<= v_prenex_3 (+ (mod v_~a3~0_2176 55) 336))))⟧)"
}
