{
  "schema_version": 1,
  "logic": "QF_S",
  "declarations": [
    {
      "kind": "constant",
      "symbol": "X",
      "parameter_sorts": [],
      "return_sort": "String"
    }
  ],
  "cnf": "(¬⟦(str.in_re X (str.to_re \"HANDYHost:Host:Host:yddznydqir/eviGatornewsSoftActivity\\u{13}\\u{a}\"))⟧) ∧\n(⟦(str.in_re X (re.++ (str.to_re \"/\") (re.union (str.to_re \"0\") (str.to_re \"1\") (str.to_re \"4\") (str.to_re \"5\") (str.to_re \"6\") (str.to_re \"7\") (str.to_re \"d\")) (str.to_re \"-/R\\u{a}\")))⟧)"
}
